sentence,sentiment,polarity,subjectivity,country
The Algerian state's interest in film-industry activities can be seen in the annual budget of DZD 200 million (EUR 1,"Sentiment(polarity=0.0, subjectivity=0.0)",0,0,Algeria
"The financial support provided by the state, through the Fund for the Development of the Arts, Techniques and the Film Industry (FDATIC) and the Algerian Agency for Cultural Influence (AARC), plays a key role in the promotion of national production","Sentiment(polarity=0.03333333333333333, subjectivity=0.3666666666666667)",0.033333333,0.366666667,Algeria
"According to the European Audiovisual Observatory's LUMIERE database, 41 Algerian films were distributed in Europe between 1996 and 2013; 21 films in this repertoire were Algerian-French co-productions","Sentiment(polarity=0.0, subjectivity=0.0)",0,0,Algeria
"Algeria won the Palme d'Or for Chronicle of the Years of Fire (1975), two Oscars for Z (1969), and other awards for the Italian-Algerian movie The Battle of Algiers","Sentiment(polarity=-0.125, subjectivity=0.375)",-0.125,0.375,Algeria
Various games have existed in Algeria since antiquity,"Sentiment(polarity=0.0, subjectivity=0.5)",0,0.5,Algeria
The first Algerian and African gold medalist is Boughera El Ouafi in 1928 Olympics of Amsterdam in the Marathon,"Sentiment(polarity=0.125, subjectivity=0.16666666666666666)",0.125,0.166666667,Algeria
Football is the most popular sport in Algeria,"Sentiment(polarity=0.55, subjectivity=0.7)",0.55,0.7,Algeria
Algerian cuisine is rich and diverse,"Sentiment(polarity=0.375, subjectivity=0.75)",0.375,0.75,Algeria
"Algerian cuisine varies from one region to another, according to seasonal vegetables","Sentiment(polarity=0.0, subjectivity=0.0)",0,0,Algeria
"Cakes are marketed and can be found in cities either in Algeria, in Europe or North America","Sentiment(polarity=0.0, subjectivity=0.0)",0,0,Algeria
"In 2002, Algeria had inadequate numbers of physicians (1","Sentiment(polarity=0.0, subjectivity=0.0)",0,0,Algeria
Health records have been maintained in Algeria since 1882 and began adding Muslims living in the south to their vital record database in 1905 during French rule,"Sentiment(polarity=0.05, subjectivity=0.2)",0.05,0.2,Algeria
"Since the 1970s, in a centralized system that was designed to significantly reduce the rate of illiteracy, the Algerian government introduced a decree by which school attendance became compulsory for all children aged between 6 and 15 years who have the ability to track their learning through the 20 facilities built since independence, now the literacy rate is around 78","Sentiment(polarity=0.1375, subjectivity=0.6375)",0.1375,0.6375,Algeria
"Since 1972, Arabic is used as the language of instruction during the first nine years of schooling","Sentiment(polarity=0.25, subjectivity=0.3333333333333333)",0.25,0.333333333,Algeria
Education is officially compulsory for children between the ages of six and 15,"Sentiment(polarity=0.0, subjectivity=0.0)",0,0,Algeria
"Algeria has 26 universities and 67 institutions of higher education, which must accommodate a million Algerians and 80,000 foreign students in 2008","Sentiment(polarity=0.0625, subjectivity=0.3125)",0.0625,0.3125,Algeria
"Even if some of them offer instruction in Arabic like areas of law and the economy, most of the other sectors as science and medicine continue to be provided in French and English","Sentiment(polarity=0.09375, subjectivity=0.21875)",0.09375,0.21875,Algeria